{"$schema":"https://json-schema.org/draft/2020-12/schema","$id":"planner-physical-reverse-audit.schema.json","type":"object","additionalProperties":false,"required":["audit_id","slides","missing_required_region_count","required_role_assignment_failure_count","out_of_content_bounds_count","hard_overlap_violation_count","selected_candidate_materialization_mismatch","physical_recipe_identity_mismatch","review_slide_mapping_failure_count","fake_candidate_variant_count","aggregate_status"],"properties":{"audit_id":{"const":"PPA-REVERSE-AUDIT-001"},"slides":{"type":"array","items":{"$ref":"#/$defs/slide"}},"missing_required_region_count":{"type":"integer","minimum":0},"required_role_assignment_failure_count":{"type":"integer","minimum":0},"out_of_content_bounds_count":{"type":"integer","minimum":0},"hard_overlap_violation_count":{"type":"integer","minimum":0},"selected_candidate_materialization_mismatch":{"type":"integer","minimum":0},"physical_recipe_identity_mismatch":{"type":"integer","minimum":0},"review_slide_mapping_failure_count":{"type":"integer","minimum":0},"fake_candidate_variant_count":{"type":"integer","minimum":0},"aggregate_status":{"enum":["pass","fail"]}},"$defs":{"box":{"type":"object","additionalProperties":false,"required":["left","top","width","height"],"properties":{"left":{"type":"number"},"top":{"type":"number"},"width":{"type":"number","exclusiveMinimum":0},"height":{"type":"number","exclusiveMinimum":0}}},"region":{"type":"object","additionalProperties":false,"required":["shape_name","logical_slide_id","candidate_id","region_id","presentation_role","item_id","bounding_box","z_order"],"properties":{"shape_name":{"type":"string","pattern":"^PPA::"},"logical_slide_id":{"type":"string"},"candidate_id":{"type":"string"},"region_id":{"type":"string"},"presentation_role":{"type":"string"},"item_id":{"type":"string"},"bounding_box":{"$ref":"#/$defs/box"},"z_order":{"type":"integer","minimum":0}}},"slide":{"type":"object","additionalProperties":false,"required":["physical_slide_index","planner_shape_count","regions"],"properties":{"physical_slide_index":{"type":"integer","minimum":1},"planner_shape_count":{"type":"integer","minimum":0},"regions":{"type":"array","items":{"$ref":"#/$defs/region"}}}}}}
