{
  "audit_id": "PPA-REVERSE-AUDIT-001",
  "slides": [
    {
      "physical_slide_index": 1,
      "planner_shape_count": 3,
      "regions": [
        {
          "shape_name": "PPA::PPA-CASE-A-EXPERIMENT::PPC-A118F5613DDB64C3::hardware::primary_visual::CAD",
          "logical_slide_id": "PPA-CASE-A-EXPERIMENT",
          "candidate_id": "PPC-A118F5613DDB64C3",
          "region_id": "hardware",
          "presentation_role": "primary_visual",
          "item_id": "CAD",
          "bounding_box": {
            "left": 1.173999343832021,
            "top": 2.2149989063867017,
            "width": 6.635999562554681,
            "height": 3.01
          },
          "z_order": 0
        },
        {
          "shape_name": "PPA::PPA-CASE-A-EXPERIMENT::PPC-A118F5613DDB64C3::procedure::procedure::CONTROLS",
          "logical_slide_id": "PPA-CASE-A-EXPERIMENT",
          "candidate_id": "PPC-A118F5613DDB64C3",
          "region_id": "procedure",
          "presentation_role": "procedure",
          "item_id": "CONTROLS",
          "bounding_box": {
            "left": 8.4025,
            "top": 2.2149989063867017,
            "width": 3.6734995625546807,
            "height": 2.063999343832021
          },
          "z_order": 1
        },
        {
          "shape_name": "PPA::PPA-CASE-A-EXPERIMENT::PPC-A118F5613DDB64C3::go::go_criterion::GO",
          "logical_slide_id": "PPA-CASE-A-EXPERIMENT",
          "candidate_id": "PPC-A118F5613DDB64C3",
          "region_id": "go",
          "presentation_role": "go_criterion",
          "item_id": "GO",
          "bounding_box": {
            "left": 8.4025,
            "top": 4.58,
            "width": 3.6734995625546807,
            "height": 0.6879997812773403
          },
          "z_order": 2
        }
      ]
    },
    {
      "physical_slide_index": 2,
      "planner_shape_count": 7,
      "regions": [
        {
          "shape_name": "PPA::PPA-CASE-B-PHYSICAL::PPC-096AA5FA0BA06EE1::photo_a::primary_visual::PHOTO-1",
          "logical_slide_id": "PPA-CASE-B-PHYSICAL",
          "candidate_id": "PPC-096AA5FA0BA06EE1",
          "region_id": "photo_a",
          "presentation_role": "primary_visual",
          "item_id": "PHOTO-1",
          "bounding_box": {
            "left": 1.173999343832021,
            "top": 2.2149989063867017,
            "width": 3.3179997812773405,
            "height": 1.418999343832021
          },
          "z_order": 0
        },
        {
          "shape_name": "PPA::PPA-CASE-B-PHYSICAL::PPC-096AA5FA0BA06EE1::photo_b::secondary_visual::PLOT-1",
          "logical_slide_id": "PPA-CASE-B-PHYSICAL",
          "candidate_id": "PPC-096AA5FA0BA06EE1",
          "region_id": "photo_b",
          "presentation_role": "secondary_visual",
          "item_id": "PLOT-1",
          "bounding_box": {
            "left": 4.8475,
            "top": 2.2149989063867017,
            "width": 3.3179997812773405,
            "height": 1.418999343832021
          },
          "z_order": 1
        },
        {
          "shape_name": "PPA::PPA-CASE-B-PHYSICAL::PPC-096AA5FA0BA06EE1::plot::validation_plot::PLOT-2",
          "logical_slide_id": "PPA-CASE-B-PHYSICAL",
          "candidate_id": "PPC-096AA5FA0BA06EE1",
          "region_id": "plot",
          "presentation_role": "validation_plot",
          "item_id": "PLOT-2",
          "bounding_box": {
            "left": 8.52099956255468,
            "top": 2.2149989063867017,
            "width": 3.555,
            "height": 2.063999343832021
          },
          "z_order": 2
        },
        {
          "shape_name": "PPA::PPA-CASE-B-PHYSICAL::PPC-096AA5FA0BA06EE1::caption_a::caption::CAPTION",
          "logical_slide_id": "PPA-CASE-B-PHYSICAL",
          "candidate_id": "PPC-096AA5FA0BA06EE1",
          "region_id": "caption_a",
          "presentation_role": "caption",
          "item_id": "CAPTION",
          "bounding_box": {
            "left": 1.173999343832021,
            "top": 3.8059995625546805,
            "width": 3.3179997812773405,
            "height": 0.43
          },
          "z_order": 3
        },
        {
          "shape_name": "PPA::PPA-CASE-B-PHYSICAL::PPC-096AA5FA0BA06EE1::caption_b::caption::REGION-CAPTION_B",
          "logical_slide_id": "PPA-CASE-B-PHYSICAL",
          "candidate_id": "PPC-096AA5FA0BA06EE1",
          "region_id": "caption_b",
          "presentation_role": "caption",
          "item_id": "REGION-CAPTION_B",
          "bounding_box": {
            "left": 4.8475,
            "top": 3.8059995625546805,
            "width": 3.3179997812773405,
            "height": 0.43
          },
          "z_order": 4
        },
        {
          "shape_name": "PPA::PPA-CASE-B-PHYSICAL::PPC-096AA5FA0BA06EE1::measurement_c::secondary_visual::PHOTO-2",
          "logical_slide_id": "PPA-CASE-B-PHYSICAL",
          "candidate_id": "PPC-096AA5FA0BA06EE1",
          "region_id": "measurement_c",
          "presentation_role": "secondary_visual",
          "item_id": "PHOTO-2",
          "bounding_box": {
            "left": 8.52099956255468,
            "top": 4.493999343832021,
            "width": 3.555,
            "height": 0.86
          },
          "z_order": 5
        },
        {
          "shape_name": "PPA::PPA-CASE-B-PHYSICAL::PPC-096AA5FA0BA06EE1::context::compact_context::REGION-CONTEXT",
          "logical_slide_id": "PPA-CASE-B-PHYSICAL",
          "candidate_id": "PPC-096AA5FA0BA06EE1",
          "region_id": "context",
          "presentation_role": "compact_context",
          "item_id": "REGION-CONTEXT",
          "bounding_box": {
            "left": 1.173999343832021,
            "top": 4.66599956255468,
            "width": 6.991499343832021,
            "height": 0.7309995625546807
          },
          "z_order": 6
        }
      ]
    },
    {
      "physical_slide_index": 3,
      "planner_shape_count": 7,
      "regions": [
        {
          "shape_name": "PPA::PPA-CASE-C-RESULT::PPC-497C2609E843D136::photo_a::primary_visual::PLOT",
          "logical_slide_id": "PPA-CASE-C-RESULT",
          "candidate_id": "PPC-497C2609E843D136",
          "region_id": "photo_a",
          "presentation_role": "primary_visual",
          "item_id": "PLOT",
          "bounding_box": {
            "left": 1.173999343832021,
            "top": 2.2149989063867017,
            "width": 3.3179997812773405,
            "height": 1.418999343832021
          },
          "z_order": 0
        },
        {
          "shape_name": "PPA::PPA-CASE-C-RESULT::PPC-497C2609E843D136::photo_b::secondary_visual::REGION-PHOTO_B",
          "logical_slide_id": "PPA-CASE-C-RESULT",
          "candidate_id": "PPC-497C2609E843D136",
          "region_id": "photo_b",
          "presentation_role": "secondary_visual",
          "item_id": "REGION-PHOTO_B",
          "bounding_box": {
            "left": 4.8475,
            "top": 2.2149989063867017,
            "width": 3.3179997812773405,
            "height": 1.418999343832021
          },
          "z_order": 1
        },
        {
          "shape_name": "PPA::PPA-CASE-C-RESULT::PPC-497C2609E843D136::plot::validation_plot::REGION-PLOT",
          "logical_slide_id": "PPA-CASE-C-RESULT",
          "candidate_id": "PPC-497C2609E843D136",
          "region_id": "plot",
          "presentation_role": "validation_plot",
          "item_id": "REGION-PLOT",
          "bounding_box": {
            "left": 8.52099956255468,
            "top": 2.2149989063867017,
            "width": 3.555,
            "height": 2.063999343832021
          },
          "z_order": 2
        },
        {
          "shape_name": "PPA::PPA-CASE-C-RESULT::PPC-497C2609E843D136::caption_a::caption::REGION-CAPTION_A",
          "logical_slide_id": "PPA-CASE-C-RESULT",
          "candidate_id": "PPC-497C2609E843D136",
          "region_id": "caption_a",
          "presentation_role": "caption",
          "item_id": "REGION-CAPTION_A",
          "bounding_box": {
            "left": 1.173999343832021,
            "top": 3.8059995625546805,
            "width": 3.3179997812773405,
            "height": 0.43
          },
          "z_order": 3
        },
        {
          "shape_name": "PPA::PPA-CASE-C-RESULT::PPC-497C2609E843D136::caption_b::caption::REGION-CAPTION_B",
          "logical_slide_id": "PPA-CASE-C-RESULT",
          "candidate_id": "PPC-497C2609E843D136",
          "region_id": "caption_b",
          "presentation_role": "caption",
          "item_id": "REGION-CAPTION_B",
          "bounding_box": {
            "left": 4.8475,
            "top": 3.8059995625546805,
            "width": 3.3179997812773405,
            "height": 0.43
          },
          "z_order": 4
        },
        {
          "shape_name": "PPA::PPA-CASE-C-RESULT::PPC-497C2609E843D136::measurement_c::secondary_visual::REGION-MEASUREMENT_C",
          "logical_slide_id": "PPA-CASE-C-RESULT",
          "candidate_id": "PPC-497C2609E843D136",
          "region_id": "measurement_c",
          "presentation_role": "secondary_visual",
          "item_id": "REGION-MEASUREMENT_C",
          "bounding_box": {
            "left": 8.52099956255468,
            "top": 4.493999343832021,
            "width": 3.555,
            "height": 0.86
          },
          "z_order": 5
        },
        {
          "shape_name": "PPA::PPA-CASE-C-RESULT::PPC-497C2609E843D136::context::compact_context::METRIC",
          "logical_slide_id": "PPA-CASE-C-RESULT",
          "candidate_id": "PPC-497C2609E843D136",
          "region_id": "context",
          "presentation_role": "compact_context",
          "item_id": "METRIC",
          "bounding_box": {
            "left": 1.173999343832021,
            "top": 4.66599956255468,
            "width": 6.991499343832021,
            "height": 0.7309995625546807
          },
          "z_order": 6
        }
      ]
    },
    {
      "physical_slide_index": 4,
      "planner_shape_count": 3,
      "regions": [
        {